{
  "schema_version":1,
  "qid":"Q000000001",
  "duration_ms":8000,
  "takeaway":"Flow moves from the higher-pressure side toward the lower-pressure side.",
  "layers":[
    {"type":"label","text":"Higher pressure","x":150,"y":90,"size":26,"start_ms":0,"end_ms":8000,"from":{"opacity":0},"to":{"opacity":1}},
    {"type":"label","text":"Lower pressure","x":490,"y":90,"size":26,"start_ms":0,"end_ms":8000,"from":{"opacity":0},"to":{"opacity":1}},
    {"type":"circle","cx":150,"cy":225,"r":72,"fill":"#dbeef4","stroke":"#16606A","stroke_width":5,"start_ms":0,"end_ms":8000,"from":{"opacity":0.5,"scale":0.92},"to":{"opacity":1,"scale":1}},
    {"type":"circle","cx":490,"cy":225,"r":72,"fill":"#eef6f2","stroke":"#3a766a","stroke_width":5,"start_ms":0,"end_ms":8000,"from":{"opacity":0.5,"scale":0.92},"to":{"opacity":1,"scale":1}},
    {"type":"arrow","x1":235,"y1":225,"x2":405,"y2":225,"stroke":"#c76542","stroke_width":8,"start_ms":1800,"end_ms":6500,"from":{"opacity":0,"x":-20},"to":{"opacity":1,"x":0}}
  ]
}
