{
  "schema_version":1,
  "qid":"Q000000002",
  "duration_ms":6000,
  "takeaway":"The key sequence is activation, directional movement, then the final effect.",
  "layers":[
    {"type":"rect","x":50,"y":165,"width":150,"height":110,"rx":24,"fill":"#e6f2ff","stroke":"#285d8a","stroke_width":4,"start_ms":0,"end_ms":6000,"from":{"opacity":0.2},"to":{"opacity":1}},
    {"type":"label","text":"Activation","x":125,"y":225,"size":22,"start_ms":0,"end_ms":6000,"from":{"opacity":0},"to":{"opacity":1}},
    {"type":"arrow","x1":215,"y1":220,"x2":315,"y2":220,"stroke":"#16606A","stroke_width":7,"start_ms":1200,"end_ms":4200,"from":{"opacity":0},"to":{"opacity":1}},
    {"type":"rect","x":330,"y":165,"width":150,"height":110,"rx":24,"fill":"#e8f5ed","stroke":"#3f7860","stroke_width":4,"start_ms":1800,"end_ms":6000,"from":{"opacity":0},"to":{"opacity":1}},
    {"type":"label","text":"Movement","x":405,"y":225,"size":22,"start_ms":1800,"end_ms":6000,"from":{"opacity":0},"to":{"opacity":1}},
    {"type":"highlight","x":500,"y":145,"width":105,"height":150,"rx":28,"fill":"#fff4cc","stroke":"#9a7621","stroke_width":4,"start_ms":3800,"end_ms":6000,"from":{"opacity":0,"scale":0.9},"to":{"opacity":1,"scale":1}},
    {"type":"label","text":"Effect","x":552,"y":225,"size":22,"start_ms":4000,"end_ms":6000,"from":{"opacity":0},"to":{"opacity":1}}
  ]
}
